{
  "$schema": "https://json-schema.org/draft/2020-12/schema",
  "$id": "https://revisemieux.fr/schemas/pivot-document-v1.json",
  "title": "PivotDocument",
  "description": "Canonical representation of a chapter's extracted content. This is a projection of the SQL tables (chapters, chapter_revisions, pages, blocks, items, notions) assembled for debugging, export, and LLM context injection. Not stored as a single document in the database.",
  "type": "object",
  "required": ["metadata", "capture_sessions", "notions"],
  "properties": {
    "metadata": {
      "type": "object",
      "required": ["chapter_id", "subject", "class_level", "title", "pivot_version", "updated_at"],
      "properties": {
        "chapter_id": {
          "type": "string",
          "format": "uuid",
          "description": "UUIDv7 of the Chapter aggregate root."
        },
        "user_id": {
          "type": "string",
          "format": "uuid"
        },
        "subject": {
          "type": "string",
          "description": "School subject (e.g., 'SVT', 'Physique-Chimie', 'Histoire-Géographie')."
        },
        "class_level": {
          "type": "string",
          "description": "Grade level (e.g., '5ème', '4ème', '3ème')."
        },
        "title": {
          "type": "string",
          "description": "Chapter title as extracted or assigned by the student."
        },
        "pack_id": {
          "type": ["string", "null"],
          "description": "Optional pack identifier (e.g., 'SVT-PHOTO')."
        },
        "pivot_version": {
          "type": "integer",
          "minimum": 1,
          "description": "Incremented on every merge operation. Version 1 = initial pipeline."
        },
        "current_revision_id": {
          "type": "string",
          "format": "uuid"
        },
        "created_at": {
          "type": "string",
          "format": "date-time"
        },
        "updated_at": {
          "type": "string",
          "format": "date-time"
        }
      }
    },
    "capture_sessions": {
      "type": "array",
      "description": "Ordered list of capture sessions (revisions). Each session represents a batch of pages uploaded together. This layer is IMMUTABLE after creation.",
      "items": {
        "type": "object",
        "required": ["revision_id", "revision_number", "status", "captured_at", "pages"],
        "properties": {
          "revision_id": {
            "type": "string",
            "format": "uuid"
          },
          "revision_number": {
            "type": "integer",
            "minimum": 1
          },
          "status": {
            "type": "string",
            "enum": ["PROCESSING", "READY", "PARTIAL", "FAILED", "PROCESSING_INCREMENTAL"]
          },
          "captured_at": {
            "type": "string",
            "format": "date-time"
          },
          "pages": {
            "type": "array",
            "items": {
              "$ref": "#/$defs/Page"
            }
          }
        }
      }
    },
    "notions": {
      "type": "array",
      "description": "Structured pedagogical content organized by Notion. This layer is MUTABLE and enriched incrementally.",
      "items": {
        "$ref": "#/$defs/Notion"
      }
    },
    "merge_log": {
      "type": "array",
      "description": "Audit trail of all merge operations performed on this chapter.",
      "items": {
        "$ref": "#/$defs/MergeLogEntry"
      }
    }
  },
  "$defs": {
    "Page": {
      "type": "object",
      "required": ["page_id", "page_order", "photo_url", "ocr_status"],
      "properties": {
        "page_id": {
          "type": "string",
          "format": "uuid"
        },
        "page_order": {
          "type": "integer",
          "minimum": 1
        },
        "photo_url": {
          "type": "string",
          "format": "uri"
        },
        "ocr_status": {
          "type": "string",
          "enum": ["UPLOADING", "OCR_PENDING", "OCR_PROCESSING", "PROCESSED", "ITEMS_GENERATING", "DONE", "NO_ITEMS", "ITEMS_FAILED", "FAILED", "BLURRY"]
        },
        "ocr_confidence": {
          "type": ["number", "null"],
          "minimum": 0,
          "maximum": 1,
          "description": "Global OCR confidence for this page. < 0.3 triggers BLURRY status (Z2-AC03)."
        },
        "text_fingerprint": {
          "type": ["string", "null"],
          "description": "Hash of OCR text for quick similarity detection (re-photograph detection)."
        },
        "blocks": {
          "type": "array",
          "description": "IMMUTABLE OCR observations. Never modified after creation.",
          "items": {
            "$ref": "#/$defs/Block"
          }
        }
      }
    },
    "Block": {
      "type": "object",
      "required": ["block_id", "block_type", "confidence"],
      "properties": {
        "block_id": {
          "type": "string",
          "format": "uuid"
        },
        "block_type": {
          "type": "string",
          "enum": ["TEXT", "PHOTO", "SCHEMA", "MAP", "GRAPH", "TABLE", "CIRCUIT", "DECORATIVE"]
        },
        "ocr_text": {
          "type": ["string", "null"],
          "description": "Raw OCR text extraction. Null for visual-only blocks."
        },
        "confidence": {
          "type": "number",
          "minimum": 0,
          "maximum": 1
        },
        "bbox": {
          "$ref": "#/$defs/BBox"
        },
        "crop_url": {
          "type": ["string", "null"],
          "format": "uri"
        },
        "visual_metadata": {
          "type": ["object", "null"],
          "description": "Additional metadata for visual blocks (SCHEMA, MAP, GRAPH, TABLE, CIRCUIT, PHOTO).",
          "properties": {
            "visual_type": {
              "type": "string",
              "enum": ["diagram", "graph", "table", "figure", "map", "circuit", "photo"]
            },
            "labels": {
              "type": "array",
              "items": {
                "type": "object",
                "properties": {
                  "text": { "type": "string" },
                  "position": { "$ref": "#/$defs/Point" }
                },
                "required": ["text"]
              }
            },
            "caption": {
              "type": ["string", "null"]
            },
            "alt_text": {
              "type": ["string", "null"]
            },
            "table_structure": {
              "type": ["object", "null"],
              "properties": {
                "rows": { "type": "integer" },
                "cols": { "type": "integer" },
                "headers": {
                  "type": ["array", "null"],
                  "items": { "type": "string" }
                },
                "cells": {
                  "type": "array",
                  "items": {
                    "type": "array",
                    "items": { "type": "string" }
                  }
                }
              },
              "required": ["rows", "cols", "cells"]
            },
            "axis_labels": {
              "type": ["object", "null"],
              "properties": {
                "x_label": { "type": "string" },
                "y_label": { "type": "string" },
                "x_unit": { "type": ["string", "null"] },
                "y_unit": { "type": ["string", "null"] }
              }
            }
          }
        }
      }
    },
    "BBox": {
      "type": "object",
      "required": ["x", "y", "w", "h"],
      "properties": {
        "x": { "type": "number" },
        "y": { "type": "number" },
        "w": { "type": "number" },
        "h": { "type": "number" }
      }
    },
    "Point": {
      "type": "object",
      "properties": {
        "x": { "type": "number" },
        "y": { "type": "number" }
      }
    },
    "Notion": {
      "type": "object",
      "required": ["notion_id", "name", "sort_order", "items"],
      "properties": {
        "notion_id": {
          "type": "string",
          "format": "uuid"
        },
        "name": {
          "type": "string",
          "description": "Human-readable notion name generated by the LLM (Z7-AC15)."
        },
        "concept_tags": {
          "type": "array",
          "items": { "type": "string" }
        },
        "sort_order": {
          "type": "integer"
        },
        "items": {
          "type": "array",
          "items": {
            "$ref": "#/$defs/Item"
          }
        }
      }
    },
    "Item": {
      "type": "object",
      "required": ["item_id", "item_type", "confidence", "source_refs", "merge_status"],
      "properties": {
        "item_id": {
          "type": "string",
          "format": "uuid"
        },
        "item_type": {
          "type": "string",
          "enum": ["KNOWLEDGE", "PROCEDURE", "DOCUMENT", "WRITING"]
        },
        "term": {
          "type": ["string", "null"],
          "description": "Main term/concept of the item."
        },
        "keywords": {
          "type": "array",
          "items": { "type": "string" }
        },
        "steps": {
          "type": "array",
          "description": "Ordered steps for PROCEDURE items.",
          "items": {
            "type": "object",
            "required": ["step_order", "content"],
            "properties": {
              "step_order": { "type": "integer" },
              "content": { "type": "string" }
            }
          }
        },
        "tags": {
          "type": "array",
          "items": { "type": "string" }
        },
        "confidence": {
          "type": "number",
          "minimum": 0,
          "maximum": 1
        },
        "fidelity_score": {
          "type": ["number", "null"],
          "minimum": 0,
          "maximum": 1,
          "description": "Result of fidelity check (Z3-AC10). Null if not yet checked."
        },
        "fidelity_flag": {
          "type": ["string", "null"],
          "enum": [null, "low", "medium"]
        },
        "validation_required": {
          "type": "boolean"
        },
        "archived": {
          "type": "boolean"
        },
        "canonical_key": {
          "type": ["string", "null"],
          "description": "Normalized identity key: lowercase(term)|item_type|pack_id. Used for deduplication."
        },
        "merge_status": {
          "type": "string",
          "enum": ["original", "enriched", "replaced", "conflict", "alternative"],
          "description": "Tracks how this item was produced: original (first pipeline), enriched (incremental add), replaced (better extraction), conflict (contradiction detected), alternative (pending HITL review)."
        },
        "replaced_by_id": {
          "type": ["string", "null"],
          "format": "uuid",
          "description": "If this item was replaced, points to the replacement item."
        },
        "source_refs": {
          "type": "array",
          "description": "Traceability: which pages and blocks produced this item.",
          "items": {
            "type": "object",
            "required": ["page_id"],
            "properties": {
              "page_id": {
                "type": "string",
                "format": "uuid"
              },
              "block_ids": {
                "type": "array",
                "items": {
                  "type": "string",
                  "format": "uuid"
                }
              }
            }
          }
        },
        "llm_model_version": {
          "type": ["string", "null"]
        },
        "prompt_template_version": {
          "type": ["string", "null"]
        },
        "created_at": {
          "type": "string",
          "format": "date-time"
        },
        "updated_at": {
          "type": "string",
          "format": "date-time"
        }
      }
    },
    "MergeLogEntry": {
      "type": "object",
      "required": ["id", "action", "reason", "created_at"],
      "properties": {
        "id": {
          "type": "string",
          "format": "uuid"
        },
        "action": {
          "type": "string",
          "enum": ["append", "enrich", "replace", "archive_dup", "flag_conflict", "create_alt"]
        },
        "source_item_id": {
          "type": ["string", "null"],
          "format": "uuid",
          "description": "The new/incoming item that triggered this action."
        },
        "target_item_id": {
          "type": ["string", "null"],
          "format": "uuid",
          "description": "The existing item affected by this action."
        },
        "reason": {
          "type": "string"
        },
        "confidence": {
          "type": ["number", "null"]
        },
        "created_at": {
          "type": "string",
          "format": "date-time"
        }
      }
    }
  }
}
