{
  "metadata": {
    "chapter_id": "019e8a3c-7b2d-7000-8001-000000000001",
    "user_id": "019e8a3c-7b2d-7000-8001-000000000099",
    "subject": "SVT",
    "class_level": "5ème",
    "title": "La photosynthèse",
    "pack_id": "SVT-PHOTO",
    "pivot_version": 3,
    "current_revision_id": "019e8a3c-7b2d-7000-8001-000000000010",
    "created_at": "2026-03-24T18:30:00Z",
    "updated_at": "2026-03-28T19:15:00Z"
  },
  "capture_sessions": [
    {
      "revision_id": "019e8a3c-7b2d-7000-8001-000000000010",
      "revision_number": 1,
      "status": "READY",
      "captured_at": "2026-03-24T18:30:00Z",
      "pages": [
        {
          "page_id": "019e8a3c-7b2d-7000-8001-000000000101",
          "page_order": 1,
          "photo_url": "s3://revisemieux/chapters/019e8a3c-7b2d-7000-8001-000000000001/revisions/019e8a3c-7b2d-7000-8001-000000000010/pages/1.webp",
          "ocr_status": "DONE",
          "ocr_confidence": 0.88,
          "text_fingerprint": "sha256:a1b2c3d4e5f6",
          "blocks": [
            {
              "block_id": "019e8a3c-7b2d-7000-8001-000000000201",
              "block_type": "TEXT",
              "ocr_text": "Chapitre 5 : La photosynthèse\n\nI. Définition\nLa photosynthèse est le processus par lequel les plantes vertes utilisent la lumière du soleil pour transformer le dioxyde de carbone (CO₂) et l'eau (H₂O) en matière organique (glucose) et en dioxygène (O₂).\n\nCe processus se déroule dans les chloroplastes, des organites présents dans les cellules végétales. Les chloroplastes contiennent la chlorophylle, un pigment vert qui capte la lumière.",
              "confidence": 0.92,
              "bbox": { "x": 0.05, "y": 0.03, "w": 0.90, "h": 0.45 },
              "crop_url": "s3://revisemieux/crops/019e8a3c-7b2d-7000-8001-000000000201.webp",
              "visual_metadata": null
            },
            {
              "block_id": "019e8a3c-7b2d-7000-8001-000000000202",
              "block_type": "TEXT",
              "ocr_text": "II. Les acteurs de la photosynthèse\n\n- Chloroplastes : organites où se déroule la photosynthèse\n- Chlorophylle : pigment vert qui capte la lumière\n- Stomates : petits orifices sur les feuilles qui permettent les échanges gazeux (entrée CO₂, sortie O₂)\n- Sève brute : transporte l'eau et les sels minéraux depuis les racines",
              "confidence": 0.89,
              "bbox": { "x": 0.05, "y": 0.50, "w": 0.90, "h": 0.45 },
              "crop_url": "s3://revisemieux/crops/019e8a3c-7b2d-7000-8001-000000000202.webp",
              "visual_metadata": null
            }
          ]
        },
        {
          "page_id": "019e8a3c-7b2d-7000-8001-000000000102",
          "page_order": 2,
          "photo_url": "s3://revisemieux/chapters/019e8a3c-7b2d-7000-8001-000000000001/revisions/019e8a3c-7b2d-7000-8001-000000000010/pages/2.webp",
          "ocr_status": "DONE",
          "ocr_confidence": 0.75,
          "text_fingerprint": "sha256:b2c3d4e5f6a1",
          "blocks": [
            {
              "block_id": "019e8a3c-7b2d-7000-8001-000000000203",
              "block_type": "SCHEMA",
              "ocr_text": null,
              "confidence": 0.82,
              "bbox": { "x": 0.10, "y": 0.05, "w": 0.80, "h": 0.55 },
              "crop_url": "s3://revisemieux/crops/019e8a3c-7b2d-7000-8001-000000000203.webp",
              "visual_metadata": {
                "visual_type": "diagram",
                "labels": [
                  { "text": "Lumière", "position": { "x": 0.50, "y": 0.02 } },
                  { "text": "CO₂", "position": { "x": 0.15, "y": 0.40 } },
                  { "text": "H₂O", "position": { "x": 0.15, "y": 0.70 } },
                  { "text": "O₂", "position": { "x": 0.85, "y": 0.40 } },
                  { "text": "Glucose (C₆H₁₂O₆)", "position": { "x": 0.85, "y": 0.70 } },
                  { "text": "Chloroplaste", "position": { "x": 0.50, "y": 0.50 } }
                ],
                "caption": "Schéma bilan de la photosynthèse",
                "alt_text": "Schéma montrant une feuille avec un chloroplaste au centre. Flèches d'entrée : lumière (en haut), CO₂ (à gauche), H₂O (en bas à gauche). Flèches de sortie : O₂ (à droite), glucose C₆H₁₂O₆ (en bas à droite).",
                "table_structure": null,
                "axis_labels": null
              }
            },
            {
              "block_id": "019e8a3c-7b2d-7000-8001-000000000204",
              "block_type": "TEXT",
              "ocr_text": "III. L'équation bilan\n\n6 CO₂ + 6 H₂O + lumière → C₆H₁₂O₆ + 6 O₂\n\nLa photosynthèse nécessite de la lumière (énergie lumineuse). Elle ne peut pas se dérouler dans l'obscurité.",
              "confidence": 0.85,
              "bbox": { "x": 0.05, "y": 0.62, "w": 0.90, "h": 0.35 },
              "crop_url": "s3://revisemieux/crops/019e8a3c-7b2d-7000-8001-000000000204.webp",
              "visual_metadata": null
            }
          ]
        },
        {
          "page_id": "019e8a3c-7b2d-7000-8001-000000000103",
          "page_order": 3,
          "photo_url": "s3://revisemieux/chapters/019e8a3c-7b2d-7000-8001-000000000001/revisions/019e8a3c-7b2d-7000-8001-000000000010/pages/3.webp",
          "ocr_status": "DONE",
          "ocr_confidence": 0.91,
          "text_fingerprint": "sha256:c3d4e5f6a1b2",
          "blocks": [
            {
              "block_id": "019e8a3c-7b2d-7000-8001-000000000205",
              "block_type": "TEXT",
              "ocr_text": "IV. Définitions à retenir\n\n- Photosynthèse : processus de fabrication de matière organique par les végétaux à partir de CO₂, H₂O et lumière\n- Chloroplaste : organite cellulaire contenant la chlorophylle, lieu de la photosynthèse\n- Chlorophylle : pigment vert responsable de la captation de la lumière\n- Stomate : orifice des feuilles permettant les échanges gazeux\n- Autotrophe : organisme capable de fabriquer sa propre matière organique (les plantes sont autotrophes)\n- Hétérotrophe : organisme qui doit consommer d'autres êtres vivants (les animaux sont hétérotrophes)",
              "confidence": 0.93,
              "bbox": { "x": 0.05, "y": 0.05, "w": 0.90, "h": 0.90 },
              "crop_url": "s3://revisemieux/crops/019e8a3c-7b2d-7000-8001-000000000205.webp",
              "visual_metadata": null
            }
          ]
        }
      ]
    },
    {
      "revision_id": "019e8a3c-7b2d-7000-8001-000000000010",
      "revision_number": 1,
      "status": "READY",
      "captured_at": "2026-03-26T18:45:00Z",
      "pages": [
        {
          "page_id": "019e8a3c-7b2d-7000-8001-000000000104",
          "page_order": 4,
          "photo_url": "s3://revisemieux/chapters/019e8a3c-7b2d-7000-8001-000000000001/revisions/019e8a3c-7b2d-7000-8001-000000000010/pages/4.webp",
          "ocr_status": "DONE",
          "ocr_confidence": 0.87,
          "text_fingerprint": "sha256:d4e5f6a1b2c3",
          "blocks": [
            {
              "block_id": "019e8a3c-7b2d-7000-8001-000000000206",
              "block_type": "TEXT",
              "ocr_text": "V. Expérience : mise en évidence de la photosynthèse\n\nProtocole :\n1. Prendre deux plantes aquatiques (élodées) dans deux béchers\n2. Placer le bécher A à la lumière et le bécher B dans l'obscurité\n3. Ajouter du bleu de bromothymol (indicateur de CO₂) dans chaque bécher\n4. Attendre 2 heures\n5. Observer la couleur du bleu de bromothymol\n\nRésultats attendus :\n- Bécher A (lumière) : le bleu de bromothymol devient bleu (le CO₂ a été consommé)\n- Bécher B (obscurité) : le bleu de bromothymol reste jaune/vert (pas de photosynthèse)",
              "confidence": 0.86,
              "bbox": { "x": 0.05, "y": 0.05, "w": 0.90, "h": 0.55 },
              "crop_url": "s3://revisemieux/crops/019e8a3c-7b2d-7000-8001-000000000206.webp",
              "visual_metadata": null
            },
            {
              "block_id": "019e8a3c-7b2d-7000-8001-000000000207",
              "block_type": "TABLE",
              "ocr_text": "Bécher A (lumière) | Bécher B (obscurité)\nCouleur initiale : jaune/vert | Couleur initiale : jaune/vert\nCouleur finale : bleu | Couleur finale : jaune/vert\nConclusion : CO₂ consommé | Conclusion : pas de photosynthèse",
              "confidence": 0.78,
              "bbox": { "x": 0.10, "y": 0.60, "w": 0.80, "h": 0.35 },
              "crop_url": "s3://revisemieux/crops/019e8a3c-7b2d-7000-8001-000000000207.webp",
              "visual_metadata": {
                "visual_type": "table",
                "labels": [],
                "caption": "Tableau de résultats de l'expérience du bleu de bromothymol",
                "alt_text": null,
                "table_structure": {
                  "rows": 4,
                  "cols": 2,
                  "headers": ["Bécher A (lumière)", "Bécher B (obscurité)"],
                  "cells": [
                    ["Couleur initiale : jaune/vert", "Couleur initiale : jaune/vert"],
                    ["Couleur finale : bleu", "Couleur finale : jaune/vert"],
                    ["CO₂ consommé", "Pas de photosynthèse"]
                  ]
                },
                "axis_labels": null
              }
            }
          ]
        },
        {
          "page_id": "019e8a3c-7b2d-7000-8001-000000000105",
          "page_order": 5,
          "photo_url": "s3://revisemieux/chapters/019e8a3c-7b2d-7000-8001-000000000001/revisions/019e8a3c-7b2d-7000-8001-000000000010/pages/5.webp",
          "ocr_status": "DONE",
          "ocr_confidence": 0.84,
          "text_fingerprint": "sha256:e5f6a1b2c3d4",
          "blocks": [
            {
              "block_id": "019e8a3c-7b2d-7000-8001-000000000208",
              "block_type": "TEXT",